{
  "schemaVersion": "plan-unit/v1",
  "unitId": "U1",
  "phaseId": "phase-1",
  "title": "Example Plan Unit Template",
  "layer": "core",
  "status": "planned",
  "dependsOn": [],
  "requirementIds": [
    "UG-01"
  ],
  "targetFiles": [
    "core/governance/schemas/plan-unit-v1.schema.json"
  ],
  "acceptanceCriteria": [
    {
      "id": "AC-U1-01",
      "requirementId": "UG-01",
      "criterion": "The plan unit conforms strictly to the plan-unit/v1 schema specification."
    }
  ],
  "testScenarios": [
    {
      "scenarioId": "TS-U1-01",
      "level": "L1",
      "description": "Validate plan unit structure against JSON schema",
      "assertion": "Schema validator produces zero errors"
    }
  ],
  "verificationCommand": "node core/scripts/validate-plan-units.js",
  "confidenceScore": 0.95
}
